{
  "$schema": "https://json-schema.org/draft/2020-12/schema",
  "$id": "urn:transit-delivery-atlas:data-schema:0.3.0",
  "title": "Transit Delivery Atlas public dataset",
  "type": "object",
  "required": ["project", "schemaVersion", "dataReviewedThrough", "source", "orderMetadata", "organizations", "themes", "directives", "evidenceScope", "evidence"],
  "properties": {
    "project": { "const": "Transit Delivery Atlas" },
    "schemaVersion": { "const": "0.3.0" },
    "dataReviewedThrough": { "$ref": "#/$defs/date" },
    "source": { "$ref": "#/$defs/source" },
    "orderMetadata": { "$ref": "#/$defs/orderMetadata" },
    "organizations": {
      "type": "array",
      "minItems": 1,
      "items": { "$ref": "#/$defs/organization" }
    },
    "themes": {
      "type": "array",
      "minItems": 1,
      "items": { "$ref": "#/$defs/theme" }
    },
    "directives": {
      "type": "array",
      "minItems": 21,
      "maxItems": 21,
      "items": { "$ref": "#/$defs/directive" }
    },
    "evidenceScope": { "$ref": "#/$defs/evidenceScope" },
    "evidence": {
      "type": "array",
      "minItems": 1,
      "items": { "$ref": "#/$defs/evidenceRecord" }
    }
  },
  "additionalProperties": false,
  "$defs": {
    "date": {
      "type": "string",
      "format": "date",
      "pattern": "^[0-9]{4}-[0-9]{2}-[0-9]{2}$"
    },
    "identifier": {
      "type": "string",
      "pattern": "^[a-z0-9-]+$"
    },
    "httpsUri": {
      "type": "string",
      "format": "uri",
      "pattern": "^https://"
    },
    "locator": {
      "type": "object",
      "required": ["section", "pages"],
      "properties": {
        "section": { "type": "string", "minLength": 1 },
        "pages": {
          "type": "array",
          "minItems": 1,
          "items": { "type": "integer", "minimum": 1, "maximum": 5 }
        }
      },
      "additionalProperties": false
    },
    "source": {
      "type": "object",
      "required": ["id", "type", "title", "publisher", "issuedOn", "effectiveOn", "url", "contextUrl", "retrievedOn", "sha256", "notes"],
      "properties": {
        "id": { "$ref": "#/$defs/identifier" },
        "type": { "const": "executive-order" },
        "title": { "type": "string", "minLength": 1 },
        "publisher": { "type": "string", "minLength": 1 },
        "issuedOn": { "$ref": "#/$defs/date" },
        "effectiveOn": { "$ref": "#/$defs/date" },
        "url": { "$ref": "#/$defs/httpsUri" },
        "contextUrl": { "$ref": "#/$defs/httpsUri" },
        "retrievedOn": { "$ref": "#/$defs/date" },
        "sha256": { "type": "string", "pattern": "^[a-f0-9]{64}$" },
        "notes": { "type": "string", "minLength": 1 }
      },
      "additionalProperties": false
    },
    "organization": {
      "type": "object",
      "required": ["id", "name", "shortName", "kind"],
      "properties": {
        "id": { "$ref": "#/$defs/identifier" },
        "name": { "type": "string", "minLength": 1 },
        "shortName": { "type": "string", "minLength": 1 },
        "kind": {
          "enum": ["state-agency", "state-commission", "state-program", "state-office", "federal-agency", "role-group"]
        }
      },
      "additionalProperties": false
    },
    "theme": {
      "type": "object",
      "required": ["id", "name"],
      "properties": {
        "id": { "$ref": "#/$defs/identifier" },
        "name": { "type": "string", "minLength": 1 }
      },
      "additionalProperties": false
    },
    "administrativeDirective": {
      "type": "object",
      "required": ["locator", "excerpt", "timingText"],
      "properties": {
        "locator": { "$ref": "#/$defs/locator" },
        "excerpt": { "type": "string", "minLength": 20 },
        "timingText": { "type": "string", "minLength": 1 }
      },
      "additionalProperties": false
    },
    "sourceContext": {
      "type": "object",
      "required": ["id", "locator", "excerpt", "appliesToDirectiveIds", "mentionedOrgIds"],
      "properties": {
        "id": { "$ref": "#/$defs/identifier" },
        "locator": { "$ref": "#/$defs/locator" },
        "excerpt": { "type": "string", "minLength": 20 },
        "appliesToDirectiveIds": {
          "type": "array",
          "minItems": 1,
          "items": { "$ref": "#/$defs/identifier" }
        },
        "mentionedOrgIds": {
          "type": "array",
          "items": { "$ref": "#/$defs/identifier" }
        }
      },
      "additionalProperties": false
    },
    "sourceNotice": {
      "type": "object",
      "required": ["id", "locator", "excerpt"],
      "properties": {
        "id": { "$ref": "#/$defs/identifier" },
        "locator": { "$ref": "#/$defs/locator" },
        "excerpt": { "type": "string", "minLength": 20 }
      },
      "additionalProperties": false
    },
    "orderMetadata": {
      "type": "object",
      "required": ["directiveCount", "administrativeDirectives", "sourceContexts", "sourceNotices"],
      "properties": {
        "directiveCount": { "const": 21 },
        "administrativeDirectives": {
          "type": "array",
          "items": { "$ref": "#/$defs/administrativeDirective" }
        },
        "sourceContexts": {
          "type": "array",
          "items": { "$ref": "#/$defs/sourceContext" }
        },
        "sourceNotices": {
          "type": "array",
          "items": { "$ref": "#/$defs/sourceNotice" }
        }
      },
      "additionalProperties": false
    },
    "qualifier": {
      "type": "object",
      "required": ["text", "appliesTo"],
      "properties": {
        "text": { "type": "string", "minLength": 1 },
        "appliesTo": { "type": "string", "minLength": 1 }
      },
      "additionalProperties": false
    },
    "sourceNote": {
      "type": "object",
      "required": ["type", "text"],
      "properties": {
        "type": { "const": "transcription" },
        "text": { "type": "string", "minLength": 1 }
      },
      "additionalProperties": false
    },
    "timing": {
      "type": "object",
      "required": ["sourceText", "kind", "value", "unit", "derivedDate", "derivation", "appliesTo"],
      "properties": {
        "sourceText": { "type": "string", "minLength": 1 },
        "kind": { "const": "relative" },
        "value": { "type": "integer", "minimum": 1 },
        "unit": { "enum": ["calendar-days", "calendar-year"] },
        "derivedDate": { "$ref": "#/$defs/date" },
        "derivation": { "type": "string", "minLength": 1 },
        "appliesTo": { "type": "string", "minLength": 1 }
      },
      "additionalProperties": false
    },
    "analyticalItem": {
      "type": "object",
      "required": ["text", "origin", "confidence"],
      "properties": {
        "text": { "type": "string", "minLength": 1 },
        "origin": { "const": "inferred" },
        "confidence": { "enum": ["low", "medium", "high"] }
      },
      "additionalProperties": false
    },
    "dependency": {
      "type": "object",
      "required": ["text", "relatedDirectiveIds", "origin", "confidence"],
      "properties": {
        "text": { "type": "string", "minLength": 1 },
        "relatedDirectiveIds": {
          "type": "array",
          "items": { "$ref": "#/$defs/identifier" }
        },
        "origin": { "const": "inferred" },
        "confidence": { "enum": ["low", "medium", "high"] }
      },
      "additionalProperties": false
    },
    "analysis": {
      "type": "object",
      "required": ["directiveId", "summary", "themeIds", "expectedOutputs", "dependencies", "openQuestions", "themes"],
      "properties": {
        "directiveId": { "$ref": "#/$defs/identifier" },
        "summary": { "type": "string", "minLength": 20 },
        "themeIds": {
          "type": "array",
          "minItems": 1,
          "items": { "$ref": "#/$defs/identifier" }
        },
        "expectedOutputs": {
          "type": "array",
          "minItems": 1,
          "items": { "$ref": "#/$defs/analyticalItem" }
        },
        "dependencies": {
          "type": "array",
          "minItems": 1,
          "items": { "$ref": "#/$defs/dependency" }
        },
        "openQuestions": {
          "type": "array",
          "minItems": 1,
          "items": { "type": "string", "minLength": 10 }
        },
        "themes": {
          "type": "array",
          "minItems": 1,
          "items": { "type": "string", "minLength": 1 }
        }
      },
      "additionalProperties": false
    },
    "evidenceScope": {
      "type": "object",
      "required": ["scope", "lastUpdatedOn", "nextReviewOn", "reviewCommitment", "coverageNote", "reviewSources", "sweeps"],
      "properties": {
        "scope": { "const": "selective" },
        "lastUpdatedOn": { "$ref": "#/$defs/date" },
        "nextReviewOn": { "$ref": "#/$defs/date" },
        "reviewCommitment": { "type": "string", "minLength": 100 },
        "coverageNote": { "type": "string", "minLength": 50 },
        "reviewSources": {
          "type": "array",
          "minItems": 1,
          "items": { "$ref": "#/$defs/evidenceReviewSource" }
        },
        "sweeps": {
          "type": "array",
          "minItems": 1,
          "items": { "$ref": "#/$defs/evidenceSweep" }
        }
      },
      "additionalProperties": false
    },
    "evidenceReviewSource": {
      "type": "object",
      "required": ["id", "name", "publisher", "url", "coversDirectiveIds", "lastCheckedOn", "lastCheckOutcome", "note"],
      "properties": {
        "id": { "$ref": "#/$defs/identifier" },
        "name": { "type": "string", "minLength": 5 },
        "publisher": { "type": "string", "minLength": 1 },
        "url": { "$ref": "#/$defs/httpsUri" },
        "coversDirectiveIds": {
          "type": "array",
          "minItems": 1,
          "items": { "$ref": "#/$defs/identifier" }
        },
        "lastCheckedOn": { "$ref": "#/$defs/date" },
        "lastCheckOutcome": { "enum": ["checked", "retrieval-failed"] },
        "note": { "type": "string", "minLength": 30 },
        "lastObservation": { "$ref": "#/$defs/lastObservation" }
      },
      "additionalProperties": false
    },
    "lastObservation": {
      "type": "object",
      "description": "A machine observation of a source's URL, recorded by a person from the worksheet `npm run sweep` prints. Optional: a source that has never been swept has no baseline, which the sweep reports by name rather than as \"unchanged\". `basis` travels with the digest because a hash over extracted text and one over raw bytes are not comparable; `mentionsOrder` is null when the document's text could not be read.",
      "required": ["sha256", "basis", "mentionsOrder", "observedOn"],
      "properties": {
        "sha256": { "type": "string", "pattern": "^[0-9a-f]{64}$" },
        "basis": { "enum": ["text", "bytes"] },
        "mentionsOrder": { "type": ["boolean", "null"] },
        "observedOn": { "$ref": "#/$defs/date" }
      },
      "additionalProperties": false
    },
    "evidenceSweep": {
      "type": "object",
      "required": ["sweptOn", "sourceIds", "addedEvidenceIds", "note"],
      "properties": {
        "sweptOn": { "$ref": "#/$defs/date" },
        "sourceIds": {
          "type": "array",
          "minItems": 1,
          "items": { "$ref": "#/$defs/identifier" }
        },
        "addedEvidenceIds": {
          "type": "array",
          "items": { "$ref": "#/$defs/identifier" }
        },
        "note": { "type": "string", "minLength": 40 }
      },
      "additionalProperties": false
    },
    "evidenceAccessibility": {
      "type": "object",
      "required": ["tagged", "note"],
      "properties": {
        "tagged": { "type": "boolean" },
        "note": { "type": "string", "minLength": 20 }
      },
      "additionalProperties": false
    },
    "evidenceLocator": {
      "type": "object",
      "required": ["pages", "locations"],
      "properties": {
        "pages": {
          "type": "array",
          "minItems": 1,
          "items": { "type": "integer", "minimum": 1 }
        },
        "locations": {
          "type": "array",
          "minItems": 1,
          "items": { "type": "string", "minLength": 10 }
        }
      },
      "additionalProperties": false
    },
    "evidenceDirectiveLink": {
      "type": "object",
      "required": ["directiveId", "relationship", "excerpt", "locator"],
      "properties": {
        "directiveId": { "$ref": "#/$defs/identifier" },
        "relationship": { "const": "explicit-citation" },
        "excerpt": { "type": "string", "minLength": 10 },
        "locator": { "$ref": "#/$defs/evidenceLocator" }
      },
      "additionalProperties": false
    },
    "evidenceRecord": {
      "type": "object",
      "required": ["id", "title", "titleOrigin", "publisher", "evidenceType", "datedOn", "dateKind", "dateOrigin", "url", "contextUrl", "retrievedOn", "lastReviewedOn", "sha256", "mediaType", "pageCount", "accessibility", "editorialSummary", "directiveLinks", "limitations"],
      "properties": {
        "id": { "$ref": "#/$defs/identifier" },
        "title": { "type": "string", "minLength": 1 },
        "titleOrigin": { "const": "publisher" },
        "publisher": { "type": "string", "minLength": 1 },
        "evidenceType": {
          "enum": ["reference-material", "meeting-material", "draft-guideline", "final-guideline", "report"]
        },
        "datedOn": { "$ref": "#/$defs/date" },
        "dateKind": { "enum": ["scheduled-event", "published", "adopted", "effective"] },
        "dateOrigin": { "const": "artifact-header" },
        "url": { "$ref": "#/$defs/httpsUri" },
        "contextUrl": { "$ref": "#/$defs/httpsUri" },
        "retrievedOn": { "$ref": "#/$defs/date" },
        "lastReviewedOn": { "$ref": "#/$defs/date" },
        "sha256": { "type": "string", "pattern": "^[a-f0-9]{64}$" },
        "mediaType": { "const": "application/pdf" },
        "pageCount": { "type": "integer", "minimum": 1 },
        "accessibility": { "$ref": "#/$defs/evidenceAccessibility" },
        "editorialSummary": { "type": "string", "minLength": 20 },
        "directiveLinks": {
          "type": "array",
          "minItems": 1,
          "items": { "$ref": "#/$defs/evidenceDirectiveLink" }
        },
        "limitations": {
          "type": "array",
          "minItems": 1,
          "items": { "type": "string", "minLength": 20 }
        }
      },
      "additionalProperties": false
    },
    "directive": {
      "type": "object",
      "required": ["id", "order", "label", "title", "titleOrigin", "sourceId", "locator", "excerpt", "leadOrgIds", "collaboratorOrgIds", "mentionedOrgIds", "sourceContextIds", "qualifiers", "sourceNotes", "timing", "lastReviewedOn", "sourceUrl", "leadOrganizations", "collaboratorOrganizations", "mentionedOrganizations", "analysis"],
      "properties": {
        "id": { "$ref": "#/$defs/identifier" },
        "order": { "type": "integer", "minimum": 1, "maximum": 21 },
        "label": { "type": "string", "minLength": 1 },
        "title": { "type": "string", "minLength": 1 },
        "titleOrigin": { "const": "editorial" },
        "sourceId": { "$ref": "#/$defs/identifier" },
        "locator": { "$ref": "#/$defs/locator" },
        "excerpt": { "type": "string", "minLength": 20 },
        "leadOrgIds": {
          "type": "array",
          "minItems": 1,
          "items": { "$ref": "#/$defs/identifier" }
        },
        "collaboratorOrgIds": {
          "type": "array",
          "items": { "$ref": "#/$defs/identifier" }
        },
        "mentionedOrgIds": {
          "type": "array",
          "items": { "$ref": "#/$defs/identifier" }
        },
        "sourceContextIds": {
          "type": "array",
          "items": { "$ref": "#/$defs/identifier" }
        },
        "qualifiers": {
          "type": "array",
          "items": { "$ref": "#/$defs/qualifier" }
        },
        "sourceNotes": {
          "type": "array",
          "items": { "$ref": "#/$defs/sourceNote" }
        },
        "timing": {
          "type": "array",
          "items": { "$ref": "#/$defs/timing" }
        },
        "lastReviewedOn": { "$ref": "#/$defs/date" },
        "sourceUrl": { "$ref": "#/$defs/httpsUri" },
        "leadOrganizations": {
          "type": "array",
          "minItems": 1,
          "items": { "type": "string", "minLength": 1 }
        },
        "collaboratorOrganizations": {
          "type": "array",
          "items": { "type": "string", "minLength": 1 }
        },
        "mentionedOrganizations": {
          "type": "array",
          "items": { "type": "string", "minLength": 1 }
        },
        "analysis": { "$ref": "#/$defs/analysis" }
      },
      "additionalProperties": false
    }
  }
}
