{
  "project": "Transit Delivery Atlas",
  "schemaVersion": "0.3.0",
  "dataReviewedThrough": "2026-10-19",
  "source": {
    "id": "ca-eo-n-7-26",
    "type": "executive-order",
    "title": "Executive Order N-7-26",
    "publisher": "State of California",
    "issuedOn": "2026-06-26",
    "effectiveOn": "2026-06-26",
    "url": "https://www.gov.ca.gov/wp-content/uploads/2026/06/ATTESTED_6.26-Transit-EO_FINAL_SIGNED.pdf",
    "contextUrl": "https://www.gov.ca.gov/2026/06/26/governor-newsom-signs-executive-order-to-accelerate-new-technologies-and-services-for-californias-local-transit-and-passenger-rail-networks-throughout-the-state/",
    "retrievedOn": "2026-07-12",
    "sha256": "5378690f2e805c60ac28fdf8417786aebad04fec1f4bcc2ccd1009cd4e680759",
    "notes": "Scanned, untagged signed PDF. Short excerpts were independently transcribed and manually reviewed; the source image controls."
  },
  "orderMetadata": {
    "directiveCount": 21,
    "administrativeDirectives": [
      {
        "locator": {
          "section": "Filing and notice clause",
          "pages": [
            5
          ]
        },
        "excerpt": "I FURTHER DIRECT that as soon as hereafter possible, this Order be filed in the Office of the Secretary of State and that widespread publicity and notice be given of this Order.",
        "timingText": "as soon as hereafter possible"
      }
    ],
    "sourceContexts": [
      {
        "id": "section-3-preamble",
        "locator": {
          "section": "3 preamble",
          "pages": [
            3
          ]
        },
        "excerpt": "Caltrans is directed to implement recommendations documented in the 2025 Transit Transformation Task Force Report to formalize the California Integrated Mobility Program through the following actions:",
        "appliesToDirectiveIds": [
          "n-7-26-3a",
          "n-7-26-3b",
          "n-7-26-3c",
          "n-7-26-3d",
          "n-7-26-3e",
          "n-7-26-3f",
          "n-7-26-3g",
          "n-7-26-3h",
          "n-7-26-3i",
          "n-7-26-3j"
        ],
        "mentionedOrgIds": [
          "caltrans",
          "cimp"
        ]
      }
    ],
    "sourceNotices": [
      {
        "id": "non-enforceability",
        "locator": {
          "section": "Non-enforceability clause",
          "pages": [
            5
          ]
        },
        "excerpt": "This Order is not intended to, and does not, create any rights or benefits, substantive or procedural, enforceable at law or in equity, against the State of California, its agencies, departments, entities, officers, employees, or any other person."
      }
    ]
  },
  "organizations": [
    {
      "id": "caltrans",
      "name": "California Department of Transportation",
      "shortName": "Caltrans",
      "kind": "state-agency"
    },
    {
      "id": "calsta",
      "name": "California State Transportation Agency",
      "shortName": "CalSTA",
      "kind": "state-agency"
    },
    {
      "id": "ctc",
      "name": "California Transportation Commission",
      "shortName": "CTC",
      "kind": "state-commission"
    },
    {
      "id": "dgs",
      "name": "California Department of General Services",
      "shortName": "DGS",
      "kind": "state-agency"
    },
    {
      "id": "hcd",
      "name": "California Department of Housing and Community Development",
      "shortName": "HCD",
      "kind": "state-agency"
    },
    {
      "id": "chsr",
      "name": "California High-Speed Rail Authority",
      "shortName": "CHSRA",
      "kind": "state-agency"
    },
    {
      "id": "calitp",
      "name": "California Integrated Travel Project",
      "shortName": "Cal-ITP",
      "kind": "state-program"
    },
    {
      "id": "cimp",
      "name": "California Integrated Mobility Program",
      "shortName": "CIMP",
      "kind": "state-program"
    },
    {
      "id": "caltrans-it",
      "name": "Caltrans Information Technology",
      "shortName": "Caltrans IT",
      "kind": "state-office"
    },
    {
      "id": "caltrans-rail",
      "name": "Caltrans Division of Rail",
      "shortName": "Division of Rail",
      "kind": "state-office"
    },
    {
      "id": "fta",
      "name": "Federal Transit Administration",
      "shortName": "FTA",
      "kind": "federal-agency"
    },
    {
      "id": "fhwa",
      "name": "Federal Highway Administration",
      "shortName": "FHWA",
      "kind": "federal-agency"
    },
    {
      "id": "usdot",
      "name": "United States Department of Transportation",
      "shortName": "USDOT",
      "kind": "federal-agency"
    },
    {
      "id": "fra",
      "name": "Federal Railroad Administration",
      "shortName": "FRA",
      "kind": "federal-agency"
    },
    {
      "id": "local-partners",
      "name": "Relevant local partners",
      "shortName": "Local partners",
      "kind": "role-group"
    },
    {
      "id": "local-agencies",
      "name": "Local agencies",
      "shortName": "Local agencies",
      "kind": "role-group"
    },
    {
      "id": "local-regional-agencies",
      "name": "Local and regional agencies",
      "shortName": "Local and regional agencies",
      "kind": "role-group"
    },
    {
      "id": "regions",
      "name": "Regions reprogramming federal formula funds",
      "shortName": "Regions",
      "kind": "role-group"
    },
    {
      "id": "fta-5307-jurisdictions",
      "name": "Jurisdictions receiving FTA Section 5307 funding",
      "shortName": "Section 5307 jurisdictions",
      "kind": "role-group"
    },
    {
      "id": "grantees-subrecipients",
      "name": "Transit grantees and subrecipients",
      "shortName": "Grantees and subrecipients",
      "kind": "role-group"
    },
    {
      "id": "transit-rail-operators",
      "name": "Transit and passenger rail operators",
      "shortName": "Transit and rail operators",
      "kind": "role-group"
    },
    {
      "id": "toll-operators",
      "name": "Toll operators",
      "shortName": "Toll operators",
      "kind": "role-group"
    },
    {
      "id": "federal-agencies",
      "name": "Relevant federal agencies",
      "shortName": "Federal agencies",
      "kind": "role-group"
    }
  ],
  "themes": [
    {
      "id": "planning-governance",
      "name": "Planning and governance"
    },
    {
      "id": "delivery-permitting",
      "name": "Project delivery and permitting"
    },
    {
      "id": "funding-grants",
      "name": "Funding and grants"
    },
    {
      "id": "data-shared-systems",
      "name": "Data, payments, and shared systems"
    },
    {
      "id": "reporting-administration",
      "name": "Reporting and administration"
    },
    {
      "id": "priority-complete-trips",
      "name": "Transit priority and complete trips"
    },
    {
      "id": "environment-assets",
      "name": "Environmental review and public assets"
    }
  ],
  "directives": [
    {
      "id": "n-7-26-1a",
      "order": 1,
      "label": "1(a)",
      "title": "Statewide transit priority project list",
      "titleOrigin": "editorial",
      "sourceId": "ca-eo-n-7-26",
      "locator": {
        "section": "1(a)",
        "pages": [
          2
        ]
      },
      "excerpt": "develop a list of transit priority projects statewide that can be updated regularly",
      "leadOrgIds": [
        "caltrans"
      ],
      "collaboratorOrgIds": [
        "local-partners"
      ],
      "mentionedOrgIds": [],
      "sourceContextIds": [],
      "qualifiers": [
        {
          "text": "where applicable",
          "appliesTo": "consistency with relevant local or regional transportation plans"
        }
      ],
      "sourceNotes": [],
      "timing": [
        {
          "sourceText": "Within 120 days of this Order",
          "kind": "relative",
          "value": 120,
          "unit": "calendar-days",
          "derivedDate": "2026-10-24",
          "derivation": "120 calendar days after the effective date",
          "appliesTo": "directive action"
        }
      ],
      "lastReviewedOn": "2026-07-12",
      "sourceUrl": "https://www.gov.ca.gov/wp-content/uploads/2026/06/ATTESTED_6.26-Transit-EO_FINAL_SIGNED.pdf",
      "leadOrganizations": [
        "California Department of Transportation"
      ],
      "collaboratorOrganizations": [
        "Relevant local partners"
      ],
      "mentionedOrganizations": [],
      "analysis": {
        "directiveId": "n-7-26-1a",
        "summary": "Create a regularly maintainable statewide list that connects transit-priority projects to location needs, applicable plans, and eligible funding.",
        "themeIds": [
          "planning-governance",
          "funding-grants"
        ],
        "expectedOutputs": [
          {
            "text": "A versioned statewide priority-project list with funding eligibility and plan crosswalks",
            "origin": "inferred",
            "confidence": "high"
          }
        ],
        "dependencies": [
          {
            "text": "Stable project and location identifiers plus an update and approval process",
            "relatedDirectiveIds": [
              "n-7-26-3e",
              "n-7-26-4",
              "n-7-26-5"
            ],
            "origin": "inferred",
            "confidence": "medium"
          }
        ],
        "openQuestions": [
          "What determines inclusion and priority?",
          "What is the refresh and conflict-resolution process?"
        ],
        "themes": [
          "Planning and governance",
          "Funding and grants"
        ]
      }
    },
    {
      "id": "n-7-26-1b",
      "order": 2,
      "label": "1(b)",
      "title": "State mobility-management role",
      "titleOrigin": "editorial",
      "sourceId": "ca-eo-n-7-26",
      "locator": {
        "section": "1(b)",
        "pages": [
          2
        ]
      },
      "excerpt": "Establish Caltrans as a Mobility Manager, as defined by the Federal Transit Administration",
      "leadOrgIds": [